{
  "record_type": "owner-exception",
  "format_version": "1",
  "book": {
    "id": "PB-0999",
    "content_hash": "sha256:aaaaaaaaaaaaaaaaaaaaaaaaaaaaaaaaaaaaaaaaaaaaaaaaaaaaaaaaaaaaaaaa"
  },
  "run_id": "RUN-001",
  "module_tag": "adr-1",
  "prompt": null,
  "place": {
    "kind": "adr-round-3-council",
    "round": 3
  },
  "owner": "Fixture Owner",
  "date": "2026-10-01",
  "reason": "fixture"
}
